{
  "_schema": "billing_event",
  "_id": "3fa85f64-5717-4562-b3fc-2c963f66afa6",
  "_org": "123",
  "_title": "Entity Title",
  "_tags": [
    "family:label"
  ],
  "type": "payment",
  "billing_amount_currency": "EUR",
  "billing_amount_decimal": "123.45",
  "billing_amount": 0,
  "direction": "debit",
  "booking_date": "2025-01-01",
  "due_date": "2025-01-01",
  "paid_date": "2025-01-01",
  "external_id": "string",
  "invoice_number": "string",
  "external_link": {
    "type": "link",
    "title": "Visit Website",
    "href": "https://example.com"
  },
  "note": "string",
  "internal_note": "string",
  "contract": {
    "$relation": [
      {
        "entity_id": "123e4567-e89b-12d3-a456-426614174000",
        "_tags": [
          "example"
        ]
      }
    ]
  },
  "related_event": {
    "$relation": [
      {
        "entity_id": "123e4567-e89b-12d3-a456-426614174000",
        "_tags": [
          "example"
        ]
      }
    ]
  },
  "_files": {
    "$relation": [
      {
        "entity_id": "123e4567-e89b-12d3-a456-426614174000",
        "_tags": [
          "example"
        ]
      }
    ]
  },
  "_created_at": "1970-01-01T00:00:00.000Z",
  "_updated_at": "1970-01-01T00:00:00.000Z",
  "_owners": [
    {
      "org_id": "123",
      "user_id": "456"
    }
  ],
  "_acl": {
    "view": [
      "org:456"
    ],
    "edit": [
      "org:456"
    ],
    "delete": [
      "org:456"
    ]
  },
  "_manifest": [
    "123e4567-e89b-12d3-a456-426614174000"
  ]
}